03:02.0 PCI bridge: Intel Corporation JHL9480 Thunderbolt 5 80/120G Bridge [Barlow Ridge Hub 80G 2023] (rev 85) (prog-if 00 [Normal decode])
	Subsystem: Device 2222:1111
	Control: I/O+ Mem+ BusMaster+ SpecCycle- MemWINV- VGASnoop- ParErr- Stepping- SERR- FastB2B- DisINTx+
	Status: Cap+ 66MHz- UDF- FastB2B- ParErr- DEVSEL=fast >TAbort- <TAbort- <MAbort- >SERR- <PERR- INTx-
	Latency: 0, Cache Line Size: 64 bytes
	Interrupt: pin A routed to IRQ 126
	Bus: primary=03, secondary=12, subordinate=1e, sec-latency=0
	I/O behind bridge: [disabled] [32-bit]
	Memory behind bridge: 86100000-87ffffff [size=31M] [32-bit]
	Prefetchable memory behind bridge: 4abec00000-4d695fffff [size=10922M] [32-bit]
	Secondary status: 66MHz- FastB2B- ParErr- DEVSEL=fast >TAbort- <TAbort- <MAbort- <SERR- <PERR-
	BridgeCtl: Parity- SERR+ NoISA- VGA- VGA16+ MAbort- >Reset- FastB2B-
		PriDiscTmr- SecDiscTmr- DiscTmrStat- DiscTmrSERREn-
	Capabilities: [80] Power Management version 3
		Flags: PMEClk- DSI- D1+ D2+ AuxCurrent=375mA PME(D0+,D1+,D2+,D3hot+,D3cold+)
		Status: D0 NoSoftRst+ PME-Enable- DSel=0 DScale=0 PME-
	Capabilities: [88] MSI: Enable+ Count=1/1 Maskable- 64bit+
		Address: 00000000fee00318  Data: 0000
	Capabilities: [ac] Subsystem: Device 2222:1111
	Capabilities: [c0] Express (v2) Downstream Port (Slot+), IntMsgNum 0
		DevCap:	MaxPayload 256 bytes, PhantFunc 0
			ExtTag+ RBE+ TEE-IO-
		DevCtl:	CorrErr+ NonFatalErr+ FatalErr+ UnsupReq+
			RlxdOrd+ ExtTag+ PhantFunc- AuxPwr- NoSnoop+
			MaxPayload 128 bytes, MaxReadReq 128 bytes
		DevSta:	CorrErr- NonFatalErr- FatalErr- UnsupReq+ AuxPwr+ TransPend-
		LnkCap:	Port #4, Speed 2.5GT/s, Width x4, ASPM L1, Exit Latency L1 <4us
			ClockPM- Surprise- LLActRep+ BwNot+ ASPMOptComp+
		LnkCtl:	ASPM L1 Enabled; LnkDisable- CommClk-
			ExtSynch- ClockPM- AutWidDis- BWInt- AutBWInt- FltModeDis-
		LnkSta:	Speed 2.5GT/s, Width x4
			TrErr- Train- SlotClk+ DLActive- BWMgmt- ABWMgmt-
		SltCap:	AttnBtn- PwrCtrl- MRL- AttnInd- PwrInd- HotPlug+ Surprise+
			Slot #2, PowerLimit 0W; Interlock- NoCompl+
		SltCtl:	Enable: AttnBtn- PwrFlt- MRL- PresDet+ CmdCplt- HPIrq+ LinkChg+
			Control: AttnInd Unknown, PwrInd Unknown, Power- Interlock-
		SltSta:	Status: AttnBtn- PowerFlt- MRL- CmdCplt- PresDet- Interlock-
			Changed: MRL- PresDet- LinkState-
		DevCap2: Completion Timeout: Not Supported, TimeoutDis- NROPrPrP- LTR+
			 10BitTagComp+ 10BitTagReq- OBFF Not Supported, ExtFmt- EETLPPrefix-
			 EmergencyPowerReduction Not Supported, EmergencyPowerReductionInit-
			 FRS- ARIFwd-
			 AtomicOpsCap: Routing-
		DevCtl2: Completion Timeout: 50us to 50ms, TimeoutDis- ARIFwd-
			 AtomicOpsCtl: EgressBlck-
			 IDOReq- IDOCompl- LTR- EmergencyPowerReductionReq-
			 10BitTagReq- OBFF Disabled, EETLPPrefixBlk-
		LnkCap2: Supported Link Speeds: 2.5GT/s, Crosslink- Retimer- 2Retimers- DRS-
		LnkCtl2: Target Link Speed: 2.5GT/s, EnterCompliance- SpeedDis-, Selectable De-emphasis: -6dB
			 Transmit Margin: Normal Operating Range, EnterModifiedCompliance- ComplianceSOS-
			 Compliance Preset/De-emphasis: -6dB de-emphasis, 0dB preshoot
		LnkSta2: Current De-emphasis Level: -3.5dB, EqualizationComplete- EqualizationPhase1-
			 EqualizationPhase2- EqualizationPhase3- LinkEqualizationRequest-
			 Retimer- 2Retimers- CrosslinkRes: unsupported, FltMode-
	Capabilities: [50] Capability ID 0x15 [0000]
	Capabilities: [100 v1] Advanced Error Reporting
		UESta:	DLP- SDES- TLP- FCP- CmpltTO- CmpltAbrt- UnxCmplt- RxOF- MalfTLP-
			ECRC- UnsupReq- ACSViol- UncorrIntErr- BlockedTLP- AtomicOpBlocked- TLPBlockedErr-
			PoisonTLPBlocked- DMWrReqBlocked- IDECheck- MisIDETLP- PCRC_CHECK- TLPXlatBlocked-
		UEMsk:	DLP- SDES- TLP- FCP- CmpltTO- CmpltAbrt- UnxCmplt- RxOF- MalfTLP-
			ECRC- UnsupReq- ACSViol- UncorrIntErr- BlockedTLP- AtomicOpBlocked- TLPBlockedErr-
			PoisonTLPBlocked- DMWrReqBlocked- IDECheck- MisIDETLP- PCRC_CHECK- TLPXlatBlocked-
		UESvrt:	DLP+ SDES- TLP- FCP+ CmpltTO- CmpltAbrt- UnxCmplt- RxOF+ MalfTLP+
			ECRC- UnsupReq- ACSViol- UncorrIntErr+ BlockedTLP- AtomicOpBlocked- TLPBlockedErr-
			PoisonTLPBlocked- DMWrReqBlocked- IDECheck- MisIDETLP- PCRC_CHECK- TLPXlatBlocked-
		CESta:	RxErr- BadTLP- BadDLLP- Rollover- Timeout- AdvNonFatalErr+ CorrIntErr- HeaderOF-
		CEMsk:	RxErr- BadTLP- BadDLLP- Rollover- Timeout- AdvNonFatalErr+ CorrIntErr- HeaderOF-
		AERCap:	First Error Pointer: 00, ECRCGenCap- ECRCGenEn- ECRCChkCap- ECRCChkEn-
			MultHdrRecCap- MultHdrRecEn- TLPPfxPres- HdrLogCap-
		HeaderLog: 00000000 00000000 00000000 00000000
	Capabilities: [130 v1] Device Serial Number e8-7c-a9-00-80-87-14-c4
	Capabilities: [140 v1] Virtual Channel
		Caps:	LPEVC=0 RefClk=100ns PATEntryBits=1
		Arb:	Fixed- WRR32- WRR64- WRR128-
		Ctrl:	ArbSelect=Fixed
		Status:	InProgress-
		VC0:	Caps:	PATOffset=00 MaxTimeSlots=1 RejSnoopTrans-
			Arb:	Fixed+ WRR32- WRR64- WRR128- TWRR128- WRR256-
			Ctrl:	Enable+ ID=0 ArbSelect=Fixed TC/VC=ff
			Status:	NegoPending+ InProgress-
	Capabilities: [160 v1] Power Budgeting <?>
	Capabilities: [170 v1] Data Link Feature <?>
	Capabilities: [500 v1] Vendor Specific Information: ID=1234 Rev=1 Len=100 <?>
	Capabilities: [600 v1] Vendor Specific Information: ID=1234 Rev=2 Len=074 <?>
	Capabilities: [400 v1] Access Control Services
		ACSCap:	SrcValid+ TransBlk+ ReqRedir+ CmpltRedir+ UpstreamFwd+ EgressCtrl+ DirectTrans+
		ACSCtl:	SrcValid- TransBlk- ReqRedir- CmpltRedir- UpstreamFwd- EgressCtrl- DirectTrans-
	Capabilities: [410 v1] Designated Vendor-Specific: Vendor=8086 ID=0006 Rev=0 Len=16 <?>
	Kernel driver in use: pcieport
	Kernel modules: shpchp
00: 86 80 86 57 07 04 10 00 85 00 04 06 10 00 01 00
10: 00 00 00 00 00 00 00 00 03 12 1e 00 f1 01 00 00
20: 10 86 f0 87 c1 be 51 69 4a 00 00 00 4d 00 00 00
30: 00 00 00 00 80 00 00 00 00 00 00 00 ff 01 12 00
40: 00 00 00 00 00 00 00 00 00 00 00 00 00 00 00 00
50: 15 00 00 00 07 02 01 00 00 00 00 00 00 00 00 00
60: 00 00 00 00 00 00 00 00 00 00 00 00 00 00 00 00
70: 00 00 00 00 00 00 00 00 00 00 00 00 00 00 00 00
80: 01 88 c3 ff 08 00 00 00 05 ac 81 00 18 03 e0 fe
90: 00 00 00 00 00 00 00 00 00 00 00 00 00 00 00 00
a0: 00 00 00 00 00 00 00 00 00 00 00 00 0d c0 00 00
b0: 22 22 11 11 00 00 00 00 00 00 00 00 00 00 00 00
c0: 10 50 62 01 21 80 01 00 1f 09 18 00 41 58 71 04
d0: 02 00 41 10 60 00 14 00 28 10 00 00 00 00 00 00
e0: 00 00 00 00 00 08 01 00 00 00 00 00 02 00 00 00
f0: 01 00 01 00 00 00 00 00 00 00 00 00 00 00 00 00

